{
  "$id": "layout_family.schema.json",
  "$schema": "https://json-schema.org/draft/2020-12/schema",
  "title": "LayoutFamily",
  "description": "A concrete-but-still-engine-neutral spatial resolution strategy for one BuildingArchetype: how to turn its GameplayGraph zones into an actual rect-based layout. Carries rotation/reflection permissions and weighted variant choices for deterministic seeded variation. Like BuildingArchetype, a LayoutFamily MUST NOT reference raw engine tile IDs.",
  "type": "object",
  "additionalProperties": false,
  "required": ["schema_version", "layout_family_id", "version", "applies_to_archetype", "resolution_strategy", "zone_placement_rules", "variants", "provenance"],
  "properties": {
    "schema_version": { "type": "string", "enum": ["0.1"] },
    "layout_family_id": { "type": "string", "pattern": "^LAY-[A-Z0-9-]+$" },
    "version": { "type": "string", "pattern": "^[0-9]+\\.[0-9]+$" },
    "name": { "type": "string" },
    "applies_to_archetype": { "type": "string" },
    "resolution_strategy": { "type": "string", "enum": ["handcrafted", "procedural", "hybrid"] },
    "tier": {
      "description": "Which of the archetype's authored layout tiers this is, e.g. compact, offset_l, zoned_expanded. Freeform, not every archetype authors all three -- see WO-0059's own required-conditions caveat. Added for WO-0059.",
      "type": "string"
    },
    "size_range": {
      "description": "This layout family's own footprint range, which must sit within its archetype's size_constraints. Added for WO-0059.",
      "type": "object",
      "additionalProperties": false,
      "properties": {
        "min_width": { "type": "integer", "minimum": 1 },
        "min_height": { "type": "integer", "minimum": 1 },
        "max_width": { "type": "integer", "minimum": 1 },
        "max_height": { "type": "integer", "minimum": 1 }
      }
    },
    "zone_placement_rules": {
      "type": "array",
      "minItems": 1,
      "items": {
        "type": "object",
        "additionalProperties": false,
        "required": ["zone_role", "placement_rule"],
        "properties": {
          "zone_role": { "type": "string" },
          "placement_rule": {
            "description": "Freeform placement directive, e.g. centered_on_primary_axis, offset_to_subzone_axis, adjacent_to:common_room.",
            "type": "string"
          },
          "notes": { "type": "string" }
        }
      }
    },
    "allow_rotation": { "type": "boolean" },
    "allow_reflection": { "type": "boolean" },
    "variants": {
      "description": "Weighted-choice pool. A seeded compiler picks one variant deterministically from these weights using the GenerationManifest seed.",
      "type": "array",
      "minItems": 1,
      "items": {
        "type": "object",
        "additionalProperties": false,
        "required": ["variant_id", "weight"],
        "properties": {
          "variant_id": { "type": "string" },
          "weight": { "type": "number", "minimum": 0 },
          "notes": { "type": "string" }
        }
      }
    },
    "provenance": {
      "type": "object",
      "additionalProperties": false,
      "required": ["source_pattern_id", "confidence"],
      "properties": {
        "source_pattern_id": { "type": "string" },
        "confidence": { "type": "string", "enum": ["high", "medium", "low", "experimental"] },
        "notes": { "type": "string" }
      }
    }
  }
}
